{
  "result_count": 10000,
  "page_count": 20,
  "page_size": 20,
  "page": 1,
  "results": [
    {
      "title": "File:Mozart - Eine kleine Nachtmusik - 1. Allegro.ogg",
      "id": "36537842-b067-4ca0-ad67-e00ff2e06b2e",
      "creator": "Wolfgang Amadeus Mozart",
      "creator_url": "https://en.wikipedia.org/wiki/Wolfgang_Amadeus_Mozart",
      "url": "https://upload.wikimedia.org/wikipedia/commons/2/24/Mozart_-_Eine_kleine_Nachtmusik_-_1._Allegro.ogg",
      "provider": "wikimedia",
      "source": "wikimedia",
      "license": "by-sa",
      "license_version": "2.0",
      "license_url": "https://creativecommons.org/licenses/by-sa/2.0/",
      "foreign_landing_url": "https://commons.wikimedia.org/w/index.php?curid=3536953",
      "detail_url": "https://api.openverse.org/v1/audio/36537842-b067-4ca0-ad67-e00ff2e06b2e",
      "related_url": "https://api.openverse.org/v1/recommendations/audio/36537842-b067-4ca0-ad67-e00ff2e06b2e",
      "fields_matched": [
        "description",
        "title"
      ],
      "tags": [
        {
          "name": "exam"
        },
        {
          "name": "tactics"
        }
      ]
    }
  ],
  "warnings": [
    {
      "code": "partially invalid request parameter",
      "message": "Some of the request parameters were bad, but we were able to process the request. Here's some information that might help you fix the problem for future requests."
    }
  ]
}